{
  "schema_version": "product-spec-v1",
  "id": "joga-hairbands-edit-subject-swap-product",
  "name": "joga-hairbands-edit-subject-swap",
  "immutable": true,
  "geometry_text": "Elastic athletic hairband, continuous woven loop, royal blue, matte finish, 25mm band width, ~480mm circumference, white JOGA wordmark centered on the band face. Preserve geometry, material and proportions (source: knowledge/products/hairbands.json)."
}
